{
  "robot": {
    "name": "validation_robot",
    "namespace": "validation_robot",
    "initial_pose": [0.0, 0.0, 0.21, 0.0, 0.0, 0.0]
  },
  "map_path": "/config/map/map.yaml",
  "nav2_parameters": "/config/simulation-amcl-test-params.yaml",
  "sensor": {
    "pose": [0.0, 0.0, 0.15, 0.0, 0.0, 0.0],
    "samples": 180,
    "min_angle_rad": -3.14159265359,
    "max_angle_rad": 3.14159265359,
    "min_range_m": 0.1,
    "max_range_m": 10.0,
    "resolution_m": 0.01,
    "update_rate_hz": 5.0
  },
  "room": {
    "size_m": [10.0, 10.0],
    "wall_thickness_m": 0.2,
    "wall_height_m": 1.0
  },
  "initial_offset": {
    "x_offset_m": 0.5,
    "y_offset_m": 0.3,
    "yaw_offset_rad": 0.3
  },
  "drive_test": {
    "linear_vel_mps": 0.2,
    "angular_vel_radps": 0.15,
    "duration_seconds": 6.0
  },
  "check": {
    "amcl_tolerance_m": 0.4,
    "minimum_initial_error_m": 0.45,
    "minimum_scan_messages": 10
  }
}
